sujet,date,statut
Synthwave et imagerie rétro-futuriste spatiale en décoration,2025-10-12T16:11:57.416634,succès_2025-10-13_09:00
Guardians of the Galaxy : quand les couleurs cosmiques deviennent pop,2025-10-12T16:19:41.226944,échec_publication
Culture rave et nébuleuses fluorescentes dans la déco moderne,2025-10-12T16:23:17.575092,échec_publication
Interstellar et la nouvelle représentation des trous noirs,2025-10-12T16:27:12.139896,succès_2025-10-13_09:00
Science-fiction française et son influence sur l'art spatial européen,2025-10-12T16:32:04.935086,succès_2025-10-13_09:00
Mouvement Outrun : l'obsession pour les horizons cosmiques,2025-10-12T16:41:30.372107,succès_2025-10-13_09:00
Steampunk spatial : l'astronomie rétro réinventée en décoration,2025-10-12T16:48:53.656826,succès_2025-10-13_09:00
Influence de Moebius sur l'esthétique désertique-spatiale,2025-10-12T16:53:15.460124,échec_publication
Cosmic Horror : de Lovecraft aux intérieurs gothiques spatiaux,2025-10-12T16:57:11.553343,échec_publication
Mythologies stellaires africaines dans l'art contemporain,2025-10-12T17:00:29.733276,échec_publication
Science-fiction française et son influence sur l'art spatial européen,2025-10-12T17:38:22.666723,succès
Mouvement Outrun : l'obsession pour les horizons cosmiques,2025-10-13T06:58:49.863457,succès
Steampunk spatial : l'astronomie rétro réinventée en décoration,2025-10-13T07:04:34.644217,succès
Influence de Moebius sur l'esthétique désertique-spatiale,2025-10-13T07:09:10.602359,succès
Comment choisir une palette de couleurs neutres pour un Airbnb ?,2025-10-13T07:48:48.775953,succès
Quelles sont les meilleures idées de décoration minimaliste pour location saisonnière ?,2025-10-13T07:53:18.247636,succès
Quel type d'encadrement uniforme choisir pour créer une cohérence sur plusieurs mètres ?,2025-10-18T14:01:13.932106,succès
Comment un tableau mural peut-il corriger visuellement un couloir trop long ?,2025-10-20T21:02:47.266867,succès
Série thématique coordonnée ou œuvres éclectiques : quelle stratégie pour un couloir ?,2025-10-23T21:03:08.264914,succès
Quels critères de résistance vérifier pour des tableaux dans un passage à fort trafic ?,2025-10-27T21:03:18.139087,succès
Faut-il des tableaux identiques des deux côtés ou varier pour créer du dynamisme ?,2025-10-30T21:02:43.367166,succès
Quels motifs éviter pour ne pas créer d'effet étourdissant dans un espace linéaire ?,2025-11-03T21:02:31.579885,succès
Comment positionner les tableaux à la bonne hauteur dans un couloir pour tous les regards ?,2025-11-06T21:03:05.093794,succès
Tableau lumineux rétroéclairé ou œuvre traditionnelle : quelle solution pour couloir sombre ?,2025-11-10T21:03:00.015410,succès
Pourquoi investir dans de vrais tableaux plutôt que des posters pour valoriser un couloir ?,2025-11-13T21:03:01.481624,succès
Quelles finitions résistent aux frottements accidentels dans un passage quotidien ?,2025-11-17T21:02:43.609079,succès
Comment choisir entre photographies en série ou peintures variées pour votre couloir ?,2025-11-20T21:03:38.105648,succès
Les œuvres abstraites ou figuratives : lesquelles fonctionnent mieux en vision périphérique ?,2025-11-24T21:02:57.927799,succès
Comment coordonner les tableaux du couloir avec les pièces qu'il dessert ?,2025-11-27T21:02:36.737309,succès
Faut-il privilégier des tons neutres ou oser la couleur dans un espace de transition ?,2025-12-01T21:02:37.193277,succès
Quels sont les labels qualité pour des tableaux exposés à la lumière artificielle constante ?,2025-12-04T21:02:54.488464,succès
Comment des tableaux bien placés peuvent-ils guider naturellement le regard vers une pièce ?,2025-12-08T21:03:13.275098,succès
Cadres fins ou épais : quel impact visuel dans un espace contraint ?,2025-12-11T21:03:01.048482,succès
Quel investissement minimal pour transformer un couloir banal en passage remarquable ?,2025-12-15T21:02:37.600016,succès
Comment vérifier la solidité des fixations sur différents types de murs de couloir ?,2025-12-18T21:02:29.049006,succès
Les triptyques horizontaux sont-ils adaptés aux longs murs de couloir ?,2025-12-22T21:02:38.175149,succès
Quel type de tableau pour un couloir distribuant chambres et salle de bain ?,2025-12-25T21:02:31.816873,succès
Comment évaluer si vos tableaux résisteront aux passages répétés sur 10 ans ?,2025-12-29T21:03:03.934376,succès
Faut-il assortir les cadres aux portes et plinthes ou créer un contraste ?,2026-01-01T21:03:06.555393,succès
Quelles dimensions pour ne pas rétrécir visuellement un couloir déjà étroit ?,2026-01-05T21:02:54.498113,succès
Comment l'éclairage LED linéaire influence-t-il le choix des couleurs de tableaux ?,2026-01-08T21:02:53.774342,succès
